{
  "format": "max-planner-transfer",
  "formatVersion": 1,
  "datasetId": "6f0c2a5e-9b1d-4c7e-8a3f-2d4b6c8e0a11",
  "exportedAtUtc": "2026-10-23T09:30:00+00:00",
  "scope": { "kind": "entire-dataset" },
  "lookups": {
    "taskStatuses": [
      { "id": "a1000000-0000-4000-8000-000000000001", "name": "Backlog", "order": 0, "isCompleted": false, "setsStartDate": false, "isBacklog": true },
      { "id": "a1000000-0000-4000-8000-000000000002", "name": "In Progress", "order": 1, "isCompleted": false, "setsStartDate": true, "isBacklog": false },
      { "id": "a1000000-0000-4000-8000-000000000003", "name": "Completed", "order": 2, "isCompleted": true, "setsStartDate": false, "isBacklog": false }
    ],
    "crStatuses": [
      { "id": "b1000000-0000-4000-8000-000000000001", "name": "Backlog", "order": 0, "isCompleted": false, "isBacklog": true },
      { "id": "b1000000-0000-4000-8000-000000000002", "name": "In Progress", "order": 1, "isCompleted": false, "isBacklog": false },
      { "id": "b1000000-0000-4000-8000-000000000003", "name": "Completed", "order": 2, "isCompleted": true, "isBacklog": false }
    ],
    "priorities": [
      { "id": "c1000000-0000-4000-8000-000000000001", "name": "High", "order": 0 },
      { "id": "c1000000-0000-4000-8000-000000000002", "name": "Medium", "order": 1 }
    ],
    "squads": [
      { "id": "d1000000-0000-4000-8000-000000000001", "name": "Retail Cards", "order": 0 }
    ],
    "people": [
      { "id": "e1000000-0000-4000-8000-000000000001", "name": "Dana Owner" },
      { "id": "e1000000-0000-4000-8000-000000000002", "name": "Sam Developer" }
    ],
    "tags": [
      { "id": "f1000000-0000-4000-8000-000000000001", "name": "api" }
    ]
  },
  "fieldDefinitions": [
    {
      "id": "aa000000-0000-4000-8000-000000000001",
      "key": "risk",
      "target": "Task",
      "label": "Risk",
      "kind": "Lookup",
      "isRequired": false,
      "displayOrder": 0,
      "options": [
        { "id": "ab000000-0000-4000-8000-000000000001", "label": "Low", "order": 0 },
        { "id": "ab000000-0000-4000-8000-000000000002", "label": "High", "order": 1 }
      ],
      "isActive": true
    }
  ],
  "defaults": {
    "defaultTaskStatusId": "a1000000-0000-4000-8000-000000000001",
    "defaultCrStatusId": "b1000000-0000-4000-8000-000000000001",
    "defaultPriorityId": "c1000000-0000-4000-8000-000000000002",
    "defaultCrOwnerId": "e1000000-0000-4000-8000-000000000001",
    "calendarSchedulingStatusId": "b1000000-0000-4000-8000-000000000002",
    "crBacklogStatusId": "b1000000-0000-4000-8000-000000000001"
  },
  "tasks": [
    {
      "id": "10000000-0000-4000-8000-000000000001",
      "service": "Payments API",
      "statusId": "a1000000-0000-4000-8000-000000000002",
      "priorityId": "c1000000-0000-4000-8000-000000000001",
      "designerIds": [],
      "developerIds": ["e1000000-0000-4000-8000-000000000002"],
      "tagIds": ["f1000000-0000-4000-8000-000000000001"],
      "notes": "Line one\nLine two with Unicode: é ✓",
      "startDate": "2026-10-05",
      "isArchived": false,
      "order": 1024,
      "checklistItems": [
        { "id": "11000000-0000-4000-8000-000000000001", "text": "Draft API spec", "isCompleted": true, "order": 1024 },
        { "id": "11000000-0000-4000-8000-000000000002", "text": "Review limits", "isCompleted": false, "order": 2048 }
      ],
      "customValues": {
        "aa000000-0000-4000-8000-000000000001": { "kind": "Lookup", "option": "ab000000-0000-4000-8000-000000000002" }
      },
      "preserved": { "preLinkTitle": "Card limits draft", "unselectedCrReferences": [] },
      "createdAtUtc": "2026-10-01T08:00:00+00:00",
      "updatedAtUtc": "2026-10-05T10:15:00+00:00",
      "revision": 4
    },
    {
      "id": "10000000-0000-4000-8000-000000000002",
      "service": "Statements",
      "statusId": "a1000000-0000-4000-8000-000000000003",
      "priorityId": "c1000000-0000-4000-8000-000000000002",
      "designerIds": [],
      "developerIds": [],
      "tagIds": [],
      "startDate": "2026-09-20",
      "endDate": "2026-09-30",
      "isArchived": false,
      "order": 1024,
      "checklistItems": [],
      "customValues": {},
      "createdAtUtc": "2026-09-15T08:00:00+00:00",
      "updatedAtUtc": "2026-09-30T16:00:00+00:00",
      "revision": 3
    },
    {
      "id": "10000000-0000-4000-8000-000000000003",
      "ownTitle": "Archived spike 007",
      "statusId": "a1000000-0000-4000-8000-000000000001",
      "priorityId": "c1000000-0000-4000-8000-000000000002",
      "designerIds": [],
      "developerIds": [],
      "tagIds": [],
      "isArchived": true,
      "order": 2048,
      "checklistItems": [],
      "customValues": {},
      "preserved": { "legacyJson": "{\"oldTracker\":\"T-17\"}" },
      "createdAtUtc": "2026-08-01T08:00:00+00:00",
      "updatedAtUtc": "2026-08-10T08:00:00+00:00",
      "revision": 2
    }
  ],
  "subtaskCards": [
    {
      "id": "20000000-0000-4000-8000-000000000001",
      "parentTaskId": "10000000-0000-4000-8000-000000000002",
      "subtitle": "Fix rounding on statements",
      "statusId": "a1000000-0000-4000-8000-000000000002",
      "startDate": "2026-10-20",
      "notes": "Found after release.",
      "order": 2048,
      "createdAtUtc": "2026-10-20T09:00:00+00:00",
      "updatedAtUtc": "2026-10-20T09:00:00+00:00",
      "revision": 1
    }
  ],
  "changeRequests": [
    {
      "id": "30000000-0000-4000-8000-000000000001",
      "number": "CR-1042",
      "title": "Card limits API",
      "ownerId": "e1000000-0000-4000-8000-000000000001",
      "squadId": "d1000000-0000-4000-8000-000000000001",
      "statusId": "b1000000-0000-4000-8000-000000000002",
      "priorityId": "c1000000-0000-4000-8000-000000000001",
      "plannedStart": "2026-10-04",
      "plannedEnd": "2026-10-15",
      "emailSubject": "RE: Card limits",
      "solutionDesignUrl": "https://example.com/designs/1042",
      "description": "Raise the daily limit.",
      "taskNumber": "00731",
      "customValues": {},
      "createdAtUtc": "2026-09-28T08:00:00+00:00",
      "updatedAtUtc": "2026-10-02T08:00:00+00:00",
      "revision": 2
    },
    {
      "id": "30000000-0000-4000-8000-000000000002",
      "number": "CR-1050",
      "title": "Statements refresh",
      "ownerId": "e1000000-0000-4000-8000-000000000001",
      "statusId": "b1000000-0000-4000-8000-000000000003",
      "priorityId": "c1000000-0000-4000-8000-000000000002",
      "customValues": {},
      "createdAtUtc": "2026-09-10T08:00:00+00:00",
      "updatedAtUtc": "2026-09-30T16:00:00+00:00",
      "revision": 3
    }
  ],
  "links": [
    { "taskId": "10000000-0000-4000-8000-000000000001", "changeRequestId": "30000000-0000-4000-8000-000000000001", "linkedAtUtc": "2026-10-02T08:05:00+00:00" },
    { "taskId": "10000000-0000-4000-8000-000000000002", "changeRequestId": "30000000-0000-4000-8000-000000000002", "linkedAtUtc": "2026-09-15T08:00:00+00:00" }
  ],
  "reviews": [
    {
      "id": "40000000-0000-4000-8000-000000000001",
      "title": "Review rate limiter",
      "crNumberText": "CR-0999",
      "taskNumberText": "0042",
      "services": ["Gateway", "Auth"],
      "developerId": "e1000000-0000-4000-8000-000000000002",
      "comments": "Looks good.\nOne nit.",
      "isDone": true,
      "completedOn": "2026-10-21",
      "order": 1024,
      "createdAtUtc": "2026-10-19T08:00:00+00:00",
      "updatedAtUtc": "2026-10-21T08:00:00+00:00",
      "revision": 2
    }
  ],
  "generalTodos": [
    {
      "id": "50000000-0000-4000-8000-000000000001",
      "text": "Renew the test certificate",
      "isCompleted": false,
      "order": 1024,
      "createdAtUtc": "2026-10-22T08:00:00+00:00",
      "updatedAtUtc": "2026-10-22T08:00:00+00:00",
      "revision": 1
    }
  ]
}
